{
  "session_id": "2026-04-23T14:30:00Z",
  "agent": "opencode",
  "nuc": "nuc1",
  "project": "slimy-harness",
  "feature_id": "self-sequencing-layer-001",
  "prompt_type": "C2",
  "status": "completed",
  "summary": "Built self-sequencing infrastructure: session report schema, Qwen dispatch prompt, validation script, and auto-sequence orchestrator.",
  "changes": [
    "sequencer/session-report.schema.json",
    "sequencer/session-report.example.json",
    "sequencer/qwen-dispatch-prompt.md",
    "sequencer/validate-next.sh",
    "sequencer/auto-sequence.sh",
    "sequencer/shutdown-addon.md"
  ],
  "tests": {
    "ran": true,
    "passed": true,
    "details": "validate-next.sh tested with valid and invalid inputs. bash -n passes on all shell scripts. JSON schemas validate."
  },
  "blockers": [],
  "recommendation": {
    "next_feature_id": null,
    "reasoning": "Infrastructure complete. Next step is integration test with live Qwen dispatch.",
    "risk_notes": "Qwen3:4b context window is limited. Monitor for truncated responses."
  },
  "kb_learnings": [
    "Qwen3:4b runs on NUC2 via Ollama API at nuc2-ts:11434",
    "Session counter stored in /home/slimy/.sequencer-state.json resets at midnight",
    "validate-next.sh is the safety boundary — Qwen output must pass all 7 checks"
  ],
  "duration_minutes": 45,
  "timestamp": "2026-04-23T15:15:00Z"
}
